timestamp_utc	commit	opt_brier	opt_log_loss	opt_roi	opt_high_conf_acc	opt_n_hc	opt_n_games	mon25_brier	mon25_roi	mon25_n_hc	mon26_brier	mon26_roi	mon26_n_hc	status	change_type	description	config_path	archive_dir
20260415T191411Z	d07e6f1	0.255299	0.720677	54.55	0.5597	795	1403	0.239674	87.91	481	0.187091	38.45	78	baseline	baseline	Production MLB setup (28 features, calibrated GBM)	/Users/matthewpokorny/Desktop/projects/cbb-quant-model/.claude/worktrees/twitter-idea-testing/mlb_research/experiments/20260415T191411Z_d07e6f1/config.json	mlb_research/experiments/20260415T191411Z_d07e6f1
20260416T164755Z	db740cd	0.255191	0.722209	32.18	0.5442	825	1403	0.240081	80.73	471	0.187222	45.18	77	reverted	features	Add park_factor	mlb_research/experiments/20260416T164755Z_db740cd/config.json	mlb_research/experiments/20260416T164755Z_db740cd
20260416T165004Z	db740cd	0.251468	0.702530	51.82	0.5581	792	1403	0.237936	118.18	466	0.176990	44.27	76	reverted	hyperparams	max_depth 4->3	mlb_research/experiments/20260416T165004Z_db740cd/config.json	mlb_research/experiments/20260416T165004Z_db740cd
20260416T165039Z	db740cd	0.248843	0.693961	73.91	0.5742	768	1403	0.235809	128.27	454	0.173675	40.36	78	reverted	hyperparams	max_depth=2	mlb_research/experiments/20260416T165039Z_db740cd/config.json	mlb_research/experiments/20260416T165039Z_db740cd
20260416T165107Z	db740cd	0.245639	0.684709	104.82	0.5981	739	1403	0.237883	117.27	465	0.185339	39.55	75	reverted	hyperparams	max_depth=1 stumps	mlb_research/experiments/20260416T165107Z_db740cd/config.json	mlb_research/experiments/20260416T165107Z_db740cd
20260416T165135Z	db740cd	0.253271	0.711809	60.64	0.5631	808	1403	0.239739	93.00	474	0.177825	40.27	80	reverted	hyperparams	learning_rate=0.03	mlb_research/experiments/20260416T165135Z_db740cd/config.json	mlb_research/experiments/20260416T165135Z_db740cd
20260416T165227Z	db740cd	0.252246	0.703691	48.91	0.5599	709	1403	0.239491	103.00	443	0.185521	41.18	81	reverted	hyperparams	n_estimators=50	mlb_research/experiments/20260416T165227Z_db740cd/config.json	mlb_research/experiments/20260416T165227Z_db740cd
20260416T165255Z	db740cd	0.253676	0.717436	74.45	0.5702	840	1403	0.237677	98.82	472	0.193676	32.73	78	reverted	hyperparams	calibration_fraction=0.3	mlb_research/experiments/20260416T165255Z_db740cd/config.json	mlb_research/experiments/20260416T165255Z_db740cd
20260416T165410Z	db740cd	0.256354	0.721827	12.73	0.5330	728	1359	0.238619	99.73	452	0.184265	34.73	76	reverted	features	Add 5 opp raw features	mlb_research/experiments/20260416T165410Z_db740cd/config.json	mlb_research/experiments/20260416T165410Z_db740cd
20260416T165530Z	db740cd	0.255987	0.737863	52.73	0.5586	793	1403	0.243324	70.64	504	0.200004	41.45	75	reverted	hyperparams	learning_rate=0.1	mlb_research/experiments/20260416T165530Z_db740cd/config.json	mlb_research/experiments/20260416T165530Z_db740cd
20260416T165615Z	db740cd	0.253763	0.711983	49.36	0.5568	783	1403	0.239345	100.82	491	0.187048	37.55	77	reverted	hyperparams	n_estimators=100	mlb_research/experiments/20260416T165615Z_db740cd/config.json	mlb_research/experiments/20260416T165615Z_db740cd
20260416T165647Z	db740cd	0.265484	0.747883	69.73	0.5543	1196	1403	0.239918	92.00	622	0.165808	45.09	79	reverted	training	no calibration	mlb_research/experiments/20260416T165647Z_db740cd/config.json	mlb_research/experiments/20260416T165647Z_db740cd
20260422T153959Z	7fee946	0.252950	0.705390	110.18	0.5724	1188	1403	0.236768	88.36	576	0.159279	41.18	81	reverted	training	LightGBM default hyperparams, uncalibrated	mlb_research/experiments/20260422T153959Z_7fee946/config.json	mlb_research/experiments/20260422T153959Z_7fee946
20260422T154135Z	7fee946	0.254834	0.710321	94.64	0.5653	1194	1403	0.233650	117.55	585	0.165749	39.36	79	reverted	training	XGBoost default hyperparams, uncalibrated	mlb_research/experiments/20260422T154135Z_7fee946/config.json	mlb_research/experiments/20260422T154135Z_7fee946
20260422T154250Z	03dd6af	0.241967	0.677269	124.64	0.5809	1143	1403	0.234517	126.36	559	0.187432	37.64	75	kept	training	LightGBM max_depth=1 stumps	mlb_research/experiments/20260422T154250Z_7fee946/config.json	mlb_research/experiments/20260422T154250Z_7fee946
20260422T154309Z	03dd6af	0.244914	0.684396	113.45	0.5761	1137	1403	0.232230	119.73	558	0.177242	41.45	75	reverted	hyperparams	LightGBM stumps n_estimators=300	mlb_research/experiments/20260422T154309Z_03dd6af/config.json	mlb_research/experiments/20260422T154309Z_03dd6af
20260422T154323Z	03dd6af	0.242091	0.677280	119.55	0.5763	1192	1403	0.237105	116.82	622	0.198290	35.91	71	reverted	hyperparams	LightGBM stumps n_estimators=75	mlb_research/experiments/20260422T154323Z_03dd6af/config.json	mlb_research/experiments/20260422T154323Z_03dd6af
20260422T154336Z	03dd6af	0.242004	0.677139	130.27	0.5813	1187	1403	0.236515	125.27	604	0.196268	36.82	72	reverted	hyperparams	LightGBM stumps learning_rate=0.03	mlb_research/experiments/20260422T154336Z_03dd6af/config.json	mlb_research/experiments/20260422T154336Z_03dd6af
20260422T154353Z	03dd6af	0.241827	0.676869	123.18	0.5808	1133	1403	0.234174	118.73	559	0.185669	36.55	78	reverted	training	XGBoost max_depth=1 stumps	mlb_research/experiments/20260422T154353Z_03dd6af/config.json	mlb_research/experiments/20260422T154353Z_03dd6af
20260422T154427Z	03dd6af	0.241890	0.677113	130.36	0.5836	1143	1403	0.234500	120.36	565	0.187481	37.64	75	reverted	features	Drop wind_speed feature	mlb_research/experiments/20260422T154427Z_03dd6af/config.json	mlb_research/experiments/20260422T154427Z_03dd6af
20260422T154543Z	03dd6af	0.240171	0.673444	156.36	0.5945	1159	1403	0.234835	124.36	561	0.186629	38.55	76	reverted	features	Prune to 13 nonzero-importance features	mlb_research/experiments/20260422T154543Z_03dd6af/config.json	mlb_research/experiments/20260422T154543Z_03dd6af
20260422T154607Z	03dd6af	0.241824	0.676968	127.73	0.5826	1138	1403	0.234569	125.36	560	0.187512	37.64	75	reverted	hyperparams	LightGBM stumps colsample_bytree=1.0	mlb_research/experiments/20260422T154607Z_03dd6af/config.json	mlb_research/experiments/20260422T154607Z_03dd6af
20260422T154632Z	03dd6af	0.241758	0.676821	124.91	0.5814	1137	1403	0.234510	125.27	562	0.187511	38.55	76	reverted	features	Add temperature feature	mlb_research/experiments/20260422T154632Z_03dd6af/config.json	mlb_research/experiments/20260422T154632Z_03dd6af
20260422T154649Z	03dd6af	0.247181	0.689118	103.27	0.5717	1130	1403	0.232956	113.91	539	0.170971	40.45	76	reverted	hyperparams	LightGBM max_depth=2	mlb_research/experiments/20260422T154649Z_03dd6af/config.json	mlb_research/experiments/20260422T154649Z_03dd6af
20260422T154804Z	03dd6af	0.240737	0.674590	138.55	0.5880	1131	1404	0.234942	123.91	571	0.185020	37.55	77	reverted	features	Prune to top-8 features	mlb_research/experiments/20260422T154804Z_03dd6af/config.json	mlb_research/experiments/20260422T154804Z_03dd6af
20260422T154837Z	03dd6af	0.242305	0.677679	132.27	0.5813	1206	1403	0.238141	117.73	623	0.203158	35.91	71	reverted	hyperparams	LightGBM stumps learning_rate=0.02	mlb_research/experiments/20260422T154837Z_03dd6af/config.json	mlb_research/experiments/20260422T154837Z_03dd6af
20260422T154857Z	03dd6af	0.240195	0.673514	157.27	0.5948	1160	1403	0.234788	125.27	562	0.187328	36.64	76	reverted	features	13-feature prune + subsample/colsample=1.0	mlb_research/experiments/20260422T154857Z_03dd6af/config.json	mlb_research/experiments/20260422T154857Z_03dd6af
20260422T154925Z	03dd6af	0.244167	0.682094	105.00	0.5966	756	1403	0.237337	114.00	474	0.181767	40.55	74	reverted	other	sklearn stumps calibrated + pruned + lr=0.03 + n_est=300	mlb_research/experiments/20260422T154925Z_03dd6af/config.json	mlb_research/experiments/20260422T154925Z_03dd6af
20260422T155002Z	03dd6af	0.241902	0.677159	130.82	0.5843	1133	1403	0.234619	119.00	553	0.189963	36.64	76	reverted	hyperparams	LightGBM stumps subsample=colsample=0.5	mlb_research/experiments/20260422T155002Z_03dd6af/config.json	mlb_research/experiments/20260422T155002Z_03dd6af
20260422T155035Z	03dd6af	0.240055	0.672866	139.91	0.5868	1164	1404	0.234721	125.00	568	0.185153	36.55	78	reverted	features	Prune to top-5 features	mlb_research/experiments/20260422T155035Z_03dd6af/config.json	mlb_research/experiments/20260422T155035Z_03dd6af
20260424T020253Z	7564a1d	0.245639	0.684709	104.82	0.5981	739	1403	0.237883	117.27	465	0.185339	39.55	75	kept	hyperparams	HUMAN OVERRIDE: calibrated sklearn depth=1 (monotone sweep + monitors corroborate)	mlb_research/configs/exp04_depth1.json	mlb_research/experiments/human_override_depth1
20260427T205210Z	606d3d3	0.248681	0.771779	87.82	0.5676	1050	1403	0.233895	123.45	581	0.169209	39.91	67	reverted	training	Run 3: LightGBM stumps isotonic calibration	mlb_research/experiments/20260427T205210Z_606d3d3/config.json	mlb_research/experiments/20260427T205210Z_606d3d3
20260427T205316Z	606d3d3	0.245424	0.684584	111.18	0.6041	725	1403	0.237871	108.82	462	0.186904	38.73	72	reverted	training	Run 3: LightGBM stumps sigmoid calibration	mlb_research/experiments/20260427T205316Z_606d3d3/config.json	mlb_research/experiments/20260427T205316Z_606d3d3
20260427T205341Z	606d3d3	0.245131	0.683892	102.00	0.5923	780	1403	0.237343	113.64	461	0.184614	40.55	74	reverted	training	Run 3: XGBoost stumps sigmoid calibration	mlb_research/experiments/20260427T205341Z_606d3d3/config.json	mlb_research/experiments/20260427T205341Z_606d3d3
20260427T205356Z	606d3d3	0.249674	0.814903	119.00	0.5893	952	1403	0.233802	119.36	671	0.173800	39.55	75	reverted	training	Run 3: XGBoost stumps isotonic calibration	mlb_research/experiments/20260427T205356Z_606d3d3/config.json	mlb_research/experiments/20260427T205356Z_606d3d3
20260427T205436Z	606d3d3	0.247488	0.801684	131.36	0.5876	1079	1403	0.232435	119.82	556	0.167583	38.64	74	reverted	training	Run 3: LGBM top-13 prune isotonic calibration	mlb_research/experiments/20260427T205436Z_606d3d3/config.json	mlb_research/experiments/20260427T205436Z_606d3d3
20260427T205505Z	606d3d3	0.243903	0.681441	124.45	0.6135	727	1403	0.237854	115.45	463	0.186717	39.64	73	reverted	training	Run 3: LGBM top-13 prune sigmoid calibration	mlb_research/experiments/20260427T205505Z_606d3d3/config.json	mlb_research/experiments/20260427T205505Z_606d3d3
20260427T205527Z	606d3d3	0.247078	0.800372	141.00	0.6090	867	1404	0.235492	114.00	621	0.167908	36.55	78	reverted	training	Run 3: LGBM top-5 prune isotonic calibration	mlb_research/experiments/20260427T205527Z_606d3d3/config.json	mlb_research/experiments/20260427T205527Z_606d3d3
20260427T205546Z	606d3d3	0.248909	0.694074	111.64	0.5773	1093	1403	0.245637	98.27	589	0.217020	15.55	78	reverted	training	Run 3: sklearn GBM margin CDF target	mlb_research/experiments/20260427T205546Z_606d3d3/config.json	mlb_research/experiments/20260427T205546Z_606d3d3
20260427T205645Z	606d3d3	0.241162	0.674927	138.00	0.6049	891	1403	0.237169	113.64	482	0.181243	40.36	78	reverted	training	Run 3: LightGBM stumps margin CDF target	mlb_research/experiments/20260427T205645Z_606d3d3/config.json	mlb_research/experiments/20260427T205645Z_606d3d3
20260427T205803Z	606d3d3	0.241359	0.675551	136.45	0.6011	925	1403	0.236947	116.09	512	0.176675	44.27	76	reverted	training	Run 3: XGBoost stumps margin CDF target	mlb_research/experiments/20260427T205803Z_606d3d3/config.json	mlb_research/experiments/20260427T205803Z_606d3d3
20260427T205817Z	606d3d3	0.241021	0.675152	146.91	0.6000	1010	1403	0.235327	116.64	500	0.163691	41.36	77	reverted	training	Run 3: LightGBM depth-2 margin CDF target	mlb_research/experiments/20260427T205817Z_606d3d3/config.json	mlb_research/experiments/20260427T205817Z_606d3d3
20260427T210059Z	606d3d3	0.240305	0.673180	139.73	0.6056	895	1403	0.237153	115.55	482	0.181714	40.36	78	reverted	features	Run 3: LGBM margin CDF top-13 prune	mlb_research/experiments/20260427T210059Z_606d3d3/config.json	mlb_research/experiments/20260427T210059Z_606d3d3
20260427T210112Z	606d3d3	0.240795	0.674248	132.45	0.5985	929	1404	0.237180	111.36	490	0.181191	40.36	78	reverted	features	Run 3: LGBM margin CDF top-5 prune	mlb_research/experiments/20260427T210112Z_606d3d3/config.json	mlb_research/experiments/20260427T210112Z_606d3d3
20260427T210126Z	606d3d3	0.240980	0.675172	108.18	0.5804	1001	1403	0.235535	118.82	494	0.165800	42.36	76	reverted	training	Run 3: LGBM depth-2 margin CDF residual fraction 0.3	mlb_research/experiments/20260427T210126Z_606d3d3/config.json	mlb_research/experiments/20260427T210126Z_606d3d3
20260427T210138Z	606d3d3	0.242600	0.678816	145.91	0.5950	1074	1403	0.235327	116.64	500	0.163691	41.36	77	reverted	training	Run 3: LGBM depth-2 margin CDF residual floor 100	mlb_research/experiments/20260427T210138Z_606d3d3/config.json	mlb_research/experiments/20260427T210138Z_606d3d3
